{
  "version": 1,
  "expressions": [
    {
      "expr": "a = 0",
      "min": 0,
      "max": 6.283185307179586,
      "anim": "loop",
      "speed": 0.35,
      "autoplay": true
    },
    {
      "expr": "b = 0.45",
      "color": "#2d70b3",
      "min": -1.5,
      "max": 1.5
    },
    {
      "expr": "d = 6",
      "min": 2.5,
      "max": 20
    },
    {
      "expr": "vx(i) = 2*mod(i, 2) - 1",
      "color": "#000000"
    },
    {
      "expr": "vy(i) = 2*mod(floor(i/2), 2) - 1",
      "color": "#000000"
    },
    {
      "expr": "vz(i) = 2*mod(floor(i/4), 2) - 1",
      "color": "#000000"
    },
    {
      "expr": "X(i) = 1.6 projx(vx(i), vy(i), vz(i), a, b, d)",
      "color": "#000000"
    },
    {
      "expr": "Y(i) = 1.6 projy(vx(i), vy(i), vz(i), a, b, d)",
      "color": "#000000"
    },
    {
      "expr": "A(k) = [0, 1, 3, 2, 4, 5, 7, 6, 0, 1, 2, 3][k + 1]",
      "color": "#000000"
    },
    {
      "expr": "B(k) = [1, 3, 2, 0, 5, 7, 6, 4, 4, 5, 6, 7][k + 1]",
      "color": "#000000"
    },
    {
      "expr": "Q(k, j) = [[0, 1, 3, 2], [4, 5, 7, 6], [0, 1, 5, 4], [2, 3, 7, 6], [0, 2, 6, 4], [1, 3, 7, 5]][k + 1, j + 1]",
      "color": "#000000"
    },
    {
      "expr": "((X(Q(k, 0)), Y(Q(k, 0))), (X(Q(k, 1)), Y(Q(k, 1))), (X(Q(k, 2)), Y(Q(k, 2))), (X(Q(k, 3)), Y(Q(k, 3)))) for k = 0..5",
      "color": "#2d70b3",
      "lineWidth": 0,
      "fill": true,
      "fillOpacity": 0.1,
      "fillColor": "hsv(57.3 a, 0.55, 0.95)"
    },
    {
      "expr": "((X(A(k)), Y(A(k))), (X(B(k)), Y(B(k)))) for k = 0..11",
      "color": "#2d70b3",
      "lineWidth": 3
    },
    {
      "expr": "(X(i), Y(i)) for i = 0..7",
      "color": "#2d70b3",
      "pointSize": 4.5
    }
  ],
  "viewport": {
    "xmin": -5,
    "xmax": 5,
    "ymin": -3.2,
    "ymax": 3.2
  },
  "features": {
    "extrema": false,
    "xIntercepts": false,
    "yIntercept": false,
    "discontinuities": false,
    "intersections": false,
    "grid": false
  },
  "panels": {
    "right": false,
    "bottom": false
  }
}
