{
  "version": 1,
  "expressions": [],
  "viewport": {
    "xmin": -6,
    "xmax": 6,
    "ymin": -5,
    "ymax": 5
  },
  "features": {
    "extrema": false,
    "xIntercepts": false,
    "yIntercept": false,
    "discontinuities": false,
    "intersections": false,
    "grid": false
  },
  "panels": {
    "right": false,
    "bottom": false
  },
  "script": "// Mandala bloom: three rings of petals counter-rotate while one clock\n// opens and closes the bloom and walks every hue round the colour wheel.\nloop(12)\nconst bloom = keyframes(time, [[0, 0.35], [4, 1], [8, 1], [12, 0.35]])\nconst w = time * PI / 6          // a full turn per loop\nconst hue = 30 * time            // and a full trip round the colour wheel\n\n// A petal pointing along +x, turned to angle q.\nfunction petal(length, width, q, h, opacity) {\n  group({ rotate: q }, () => {\n    curve(u => [length * (1 - cos(u)) / 2, width * sin(u) * (1 - cos(u)) / 2], 0, TAU, {\n      color: hsv(h, 0.75, 0.8), fill: hsv(h, 0.6, 1, opacity), width: 1.5, samples: 90,\n    })\n  })\n}\n\ncircle(0, 0, 4.4 * bloom, { color: hsv(hue + 200, 0.5, 0.75), width: 1.5, dash: \"dotted\" })\nfor (const k of range(12)) petal(3.9 * bloom, 1.5 * bloom, w + k * PI / 6, hue, 0.32)\nfor (const k of range(12)) petal(2.7 * bloom, 1.1 * bloom, -w + PI / 12 + k * PI / 6, hue + 120, 0.45)\nfor (const k of range(6))  petal(1.7 * bloom, 0.7 * bloom, 2 * w + k * PI / 3, hue + 240, 0.7)\nfor (const k of range(24)) {\n  const q = -w / 2 + k * PI / 12\n  point(4.4 * bloom * cos(q), 4.4 * bloom * sin(q), { size: 3, color: hsv(hue + 40, 0.8, 0.9) })\n}\ncircle(0, 0, 0.55 + 0.08 * sin(2 * w), { fill: hsv(42, 0.75, 1), color: hsv(hue + 300, 0.7, 0.8) })\ncircle(0, 0, 0.22, { fill: hsv(30, 0.9, 0.55, 0.85) })\n"
}
