{
  "version": 1,
  "expressions": [],
  "viewport": {
    "xmin": -4.5,
    "xmax": 4.5,
    "ymin": -3,
    "ymax": 3
  },
  "features": {
    "extrema": false,
    "xIntercepts": false,
    "yIntercept": false,
    "discontinuities": false,
    "intersections": false,
    "grid": false
  },
  "panels": {
    "right": false,
    "bottom": false
  },
  "script": "// Sharingan: three tomoe orbit the pupil.\nloop(4)                          // seconds per loop\nconst spin = -time / 4 * TAU / 3 // a third of a turn per loop: the pattern looks the same\n\n// One tomoe (\"comma\"): a round back, then in under the head and out round the tail.\n// It sits on the ring at `angle`, turned to follow it.\nfunction tomoe(angle, size) {\n  const [x, y] = [1.25 * cos(angle), 1.25 * sin(angle)]\n  group({ translate: [x, y], rotate: angle }, () => {\n    path({ fill: \"#120a0a\" })\n      .arc(0, 0, 2 * size, PI / 2, -PI / 2)\n      .arc(0, -size, size, -PI / 2, PI / 2)\n      .arc(0, size, size, -PI / 2, -3 * PI / 2)\n      .close()\n  })\n}\n\ncircle(0, 0, 2, { fill: \"#b3121b\", color: \"#2a0505\", width: 3 })   // iris\ncircle(0, 0, 1.55, { fill: alpha(\"#e0393f\", 0.5) })                 // inner glow\ncircle(0, 0, 1.25, { color: \"rgba(60, 8, 8, 0.85)\", width: 1.6 })   // the ring the tomoe ride on\ncircle(0, 0, 0.42, { fill: \"#0b0b0b\" })                             // pupil\nfor (const k of range(3)) tomoe(spin + k * TAU / 3, 0.22)\nellipse(-0.8, 0.9, 0.24, 0.15, { fill: alpha(\"white\", 0.7) })       // highlight\n"
}
